{
  "$schema": "https://json-schema.org/draft/2020-12/schema",
  "title": "routes-v1",
  "description": "Meta-schema for routes-v1.json — the declarative route flow-shape manifest. 文件本身无运行时 validator 加载（与仓库其他 schema 一致，作为结构契约文档）；test_routes_manifest.sh 用 jq 做实际结构校验。",
  "type": "object",
  "required": ["schema_version", "global_transitions", "verdict_routing", "routes"],
  "properties": {
    "schema_version": { "type": "string", "const": "1" },
    "description": { "type": "string" },
    "verdict_routing": {
      "type": "object",
      "description": "Workflow-level verdict → 机械动作映射（A1）。键为 phase（discovery / plan-writing / execution / final-review / multi-pr-merge / direct-repair），值为 verdict → 路由记录。judgment=true 的记录只给候选动作（action=candidates / ask-user / report-user），最终选择留给 Coordinator 散文判断——数据不僵化判断类分支。state.sh verdict-route 运行时读取；缺数据 fail-open 回退 SKILL.md 散文。",
      "additionalProperties": {
        "type": "object",
        "additionalProperties": {
          "type": "object",
          "required": ["action", "judgment"],
          "properties": {
            "action": { "type": "string", "enum": ["goto", "ask-user", "report-user", "invoke-skill", "candidates", "reflux-counter"] },
            "target": { "type": ["string", "null"], "description": "goto 的目标 phase / invoke-skill 的 skill 名 / ask-user 回答后重进的 phase。" },
            "judgment": { "type": "boolean", "description": "true = 含人/模型判断成分，数据只供候选；false = 纯机械跳转。" },
            "note": { "type": "string" }
          }
        }
      }
    },
    "global_transitions": {
      "type": "array",
      "description": "route-无关的 work-item 状态机转换，格式 'actor:from:to'，* 通配。对所有 route 生效。",
      "items": { "type": "string", "pattern": "^[A-Za-z*-]+:[A-Za-z*_-]+:[A-Za-z*_-]+$" },
      "minItems": 1
    },
    "routes": {
      "type": "object",
      "description": "每个 route 一条记录，键为 route 名（须覆盖 workflow-state-v1.json route enum 的全部值）。",
      "additionalProperties": {
        "type": "object",
        "required": ["phases", "phase_transitions", "dispatch_shape", "budget", "commit_format"],
        "properties": {
          "repair_policy": {
            "type": "object",
            "description": "Per-phase 修复轮次策略。键为 phase 名（execution / final-review / plan-review），值含 max_repair_rounds（worker/coordinator 修复轮上限）与 escalate_to_rca（超限后是否升级 root_cause_analyst）。由 enforce-repair-round-cap.sh hook 在运行时读取做机器强制。不含本字段的 route 对该 phase 无轮次上限检查（fail-open）。",
            "additionalProperties": {
              "type": "object",
              "required": ["max_repair_rounds", "escalate_to_rca"],
              "properties": {
                "max_repair_rounds": {
                  "type": "integer",
                  "minimum": 1,
                  "description": "Worker/Coordinator 修复轮上限（不含 RCA escalation 轮）。"
                },
                "escalate_to_rca": {
                  "type": "boolean",
                  "description": "达到上限后是否升级 root_cause_analyst（再给 1 轮）。false = 直接 BLOCKED。"
                }
              }
            }
          },
          "phases": {
            "type": "array",
            "description": "本 route 实际经过的 phase 有序序列。",
            "items": { "type": "string" }
          },
          "phase_transitions": {
            "type": "array",
            "description": "本 route 合法的 phase 推进，格式 'Coordinator:from:to'。轻档不含 workflow:discovery 即机器拦截误跳。",
            "items": { "type": "string", "pattern": "^[A-Za-z*-]+:[A-Za-z*_-]+:[A-Za-z*_-]+$" }
          },
          "dispatch_shape": {
            "type": "object",
            "description": "phase→派发形态。取代 validate-plan-dispatch / dispatch-route-worker / validate-pack-manifest 的 phase 字面量。",
            "additionalProperties": { "type": "string", "enum": ["plan-level", "route-worker"] }
          },
          "budget": {
            "type": "object",
            "required": ["init"],
            "description": "预算初始档。公式与档位常量的唯一权威源是 state.sh（REVIEW_PER_PLAN / REVIEW_FIXED_RESERVE + profile 分支），routes 不声明公式。",
            "properties": {
              "init": { "type": "string", "enum": ["pending_plan_count", "unlimited"] }
            }
          },
          "commit_format": {
            "type": ["string", "null"],
            "description": "取代假 commit_format_override。如 hotfix 子变体用 'hotfix-unreviewed'。"
          },
          "review_required": {
            "type": "array",
            "description": "本 route 触发 Codex review 闸门的 review_intent 白名单（取代 gate-codex-review.sh 的硬编码 case baseline）。execution 承载路由（formal/light）声明 'baseline' → Plan Implementation Review 的 pack-completion 闸门生效；route-worker 路由声明 []（无 Plan Implementation Review）。由 gate-codex-review.sh 运行时读取；缺本字段 = fail-open 回退旧字面量。",
            "items": { "type": "string", "enum": ["baseline"] }
          }
        }
      }
    }
  }
}
